{
  "caption": "Linux Dictionary",
  "description": "The Linux extension attribute dictionary defines Linux-specific attributes and their types.",
  "name": "dictionary",
  "attributes": {
    "cgroup": {
      "caption": "cgroup",
      "description": "The Linux control group (cgroup) associated with the object or activity.",
      "type": "cgroup"
    }
  }
}
